{
  "schema_version": 1,
  "catalog_version": "2026-09-21.1",
  "source_date": "2026-09-21",
  "models": [
    {
      "id": "soul-2",
      "display_name": "SOUL 2",
      "provider": "Higgsfield",
      "family": "SOUL",
      "endpoint": "higgsfield-ai/soul/v2/standard",
      "capability": "image_generate",
      "output": "image",
      "parameters": [
        {"name": "prompt", "type": "string", "required": true},
        {"name": "aspect_ratio", "type": "string", "default": "4:3", "choices": ["1:1", "4:3", "3:4", "16:9", "9:16"]},
        {"name": "resolution", "type": "string", "default": "720p", "choices": ["720p", "1080p"]},
        {"name": "style_id", "type": "string"},
        {"name": "batch_size", "type": "integer", "default": 1, "minimum": 1, "maximum": 4},
        {"name": "enhance_prompt", "type": "boolean", "default": true},
        {"name": "seed", "type": "integer", "minimum": 0}
      ],
      "result_field": "images",
      "docs_source": "https://docs.higgsfield.ai/docs/models/soul-2/generate.md",
      "docs_checked": "2026-09-21",
      "status": "active"
    },
    {
      "id": "soul-cinema",
      "display_name": "SOUL Cinema",
      "provider": "Higgsfield",
      "family": "SOUL",
      "endpoint": "higgsfield-ai/soul/cinema",
      "capability": "image_generate",
      "output": "image",
      "parameters": [
        {"name": "prompt", "type": "string", "required": true},
        {"name": "aspect_ratio", "type": "string", "default": "4:3", "choices": ["1:1", "4:3", "3:4", "16:9", "9:16"]},
        {"name": "resolution", "type": "string", "default": "720p", "choices": ["720p", "1080p"]},
        {"name": "batch_size", "type": "integer", "default": 1, "minimum": 1, "maximum": 4},
        {"name": "enhance_prompt", "type": "boolean", "default": true},
        {"name": "seed", "type": "integer", "minimum": 0}
      ],
      "result_field": "images",
      "docs_source": "https://docs.higgsfield.ai/docs/models/soul-cinema/generate.md",
      "docs_checked": "2026-09-21",
      "status": "active"
    },
    {
      "id": "soul-standard",
      "display_name": "SOUL",
      "provider": "Higgsfield",
      "family": "SOUL",
      "endpoint": "higgsfield-ai/soul/standard",
      "capability": "image_generate",
      "output": "image",
      "parameters": [
        {"name": "prompt", "type": "string", "required": true},
        {"name": "aspect_ratio", "type": "string", "default": "4:3", "choices": ["1:1", "4:3", "3:4", "16:9", "9:16"]},
        {"name": "resolution", "type": "string", "default": "720p", "choices": ["720p", "1080p"]},
        {"name": "style_id", "type": "string"},
        {"name": "batch_size", "type": "integer", "default": 1, "minimum": 1, "maximum": 4},
        {"name": "enhance_prompt", "type": "boolean", "default": true},
        {"name": "seed", "type": "integer", "minimum": 0}
      ],
      "result_field": "images",
      "docs_source": "https://docs.higgsfield.ai/docs/models/soul-standard/generate.md",
      "docs_checked": "2026-09-21",
      "status": "active"
    },
    {
      "id": "marketing-studio-image",
      "display_name": "Marketing Studio Image",
      "provider": "Higgsfield",
      "family": "Marketing Studio",
      "endpoint": "marketing-studio/image",
      "capability": "image_edit",
      "output": "image",
      "parameters": [
        {"name": "prompt", "type": "string", "required": true},
        {"name": "image_urls", "type": "array", "min_items": 1, "max_items": 4, "media_types": ["image"]},
        {"name": "aspect_ratio", "type": "string", "default": "4:3", "choices": ["1:1", "4:3", "3:4", "16:9", "9:16", "auto"]},
        {"name": "resolution", "type": "string", "default": "1080p", "choices": ["720p", "1080p"]},
        {"name": "enhance_prompt", "type": "boolean", "default": false},
        {"name": "preset_id", "type": "string"}
      ],
      "input_media": ["image"],
      "max_references": 4,
      "result_field": "images",
      "docs_source": "https://docs.higgsfield.ai/docs/models/marketing-studio-image/generate-and-edit.md",
      "docs_checked": "2026-09-21",
      "status": "active"
    },
    {
      "id": "recraft-v4-1-pro",
      "display_name": "Recraft V4.1 Pro",
      "provider": "Recraft",
      "family": "Recraft V4.1",
      "endpoint": "recraft/v4.1/pro/text-to-image",
      "capability": "image_generate",
      "output": "image",
      "parameters": [
        {"name": "prompt", "type": "string", "required": true},
        {"name": "aspect_ratio", "type": "string", "default": "1:1", "choices": ["1:1", "4:5", "3:4", "4:3", "5:4", "16:9", "9:16"]},
        {"name": "style", "type": "string"},
        {"name": "seed", "type": "integer", "minimum": 0}
      ],
      "result_field": "images",
      "docs_source": "https://docs.higgsfield.ai/docs/models/recraft-v4-1-pro/generate.md",
      "docs_checked": "2026-09-21",
      "status": "active"
    },
    {
      "id": "grok-image-2",
      "display_name": "Grok Image 2.0",
      "provider": "xAI",
      "family": "Grok Imagine",
      "endpoint": "xai/grok-imagine-image-2.0",
      "capability": "image_edit",
      "output": "image",
      "parameters": [
        {"name": "prompt", "type": "string", "required": true},
        {"name": "quality", "type": "string", "default": "medium", "choices": ["low", "medium", "high"]},
        {"name": "image_urls", "type": "array", "min_items": 1, "max_items": 3, "media_types": ["image"]},
        {"name": "resolution", "type": "string", "default": "1k", "choices": ["1k", "2k"]},
        {"name": "aspect_ratio", "type": "string", "default": "auto", "choices": ["auto", "1:1", "4:3", "3:4", "16:9", "9:16"]}
      ],
      "input_media": ["image"],
      "max_references": 3,
      "result_field": "images",
      "docs_source": "https://docs.higgsfield.ai/docs/models/grok-image-2/generate-and-edit.md",
      "docs_checked": "2026-09-21",
      "status": "active"
    },
    {
      "id": "seedance-2-text-to-video",
      "display_name": "Seedance 2.0 · Text to Video",
      "provider": "ByteDance",
      "family": "Seedance 2.0",
      "endpoint": "bytedance/seedance-2.0/text-to-video",
      "capability": "text_to_video",
      "output": "video",
      "parameters": [
        {"name": "prompt", "type": "string", "required": true},
        {"name": "resolution", "type": "string", "default": "720p", "choices": ["480p", "720p"]},
        {"name": "duration", "type": "integer", "default": 5, "minimum": 4, "maximum": 15},
        {"name": "aspect_ratio", "type": "string", "default": "16:9", "choices": ["16:9", "4:3", "1:1", "3:4", "9:16", "21:9"]},
        {"name": "generate_audio", "type": "boolean", "default": true},
        {"name": "output_format", "type": "string", "default": "mp4", "choices": ["mp4", "mov"]}
      ],
      "result_field": "video",
      "docs_source": "https://docs.higgsfield.ai/docs/models/seedance-2/text-to-video.md",
      "docs_checked": "2026-09-21",
      "status": "active"
    },
    {
      "id": "seedance-2-image-to-video",
      "display_name": "Seedance 2.0 · Image to Video",
      "provider": "ByteDance",
      "family": "Seedance 2.0",
      "endpoint": "bytedance/seedance-2.0/image-to-video",
      "capability": "image_to_video",
      "output": "video",
      "parameters": [
        {"name": "prompt", "type": "string"},
        {"name": "resolution", "type": "string", "default": "720p", "choices": ["480p", "720p"]},
        {"name": "duration", "type": "integer", "default": 5, "minimum": 4, "maximum": 15},
        {"name": "image_url", "type": "string", "required": true, "media_types": ["image"]},
        {"name": "output_format", "type": "string", "default": "mp4", "choices": ["mp4", "mov"]}
      ],
      "input_media": ["image"],
      "max_references": 1,
      "result_field": "video",
      "docs_source": "https://docs.higgsfield.ai/docs/models/seedance-2/image-to-video.md",
      "docs_checked": "2026-09-21",
      "status": "active"
    },
    {
      "id": "seedance-2-reference-to-video",
      "display_name": "Seedance 2.0 · Reference to Video",
      "provider": "ByteDance",
      "family": "Seedance 2.0",
      "endpoint": "bytedance/seedance-2.0/reference-to-video",
      "capability": "reference_to_video",
      "output": "video",
      "parameters": [
        {"name": "prompt", "type": "string"},
        {"name": "resolution", "type": "string", "default": "720p", "choices": ["480p", "720p"]},
        {"name": "duration", "type": "integer", "default": 5, "minimum": 4, "maximum": 15},
        {"name": "aspect_ratio", "type": "string", "default": "16:9", "choices": ["16:9", "4:3", "1:1", "3:4", "9:16", "21:9"]},
        {"name": "generate_audio", "type": "boolean", "default": true},
        {"name": "image_urls", "type": "array", "min_items": 1, "max_items": 30, "media_types": ["image"]},
        {"name": "video_urls", "type": "array", "min_items": 1, "max_items": 10, "media_types": ["video"]},
        {"name": "audio_urls", "type": "array", "min_items": 1, "max_items": 10, "media_types": ["audio"]},
        {"name": "output_format", "type": "string", "default": "mp4", "choices": ["mp4", "mov"]}
      ],
      "input_media": ["image", "video", "audio"],
      "max_references": 30,
      "result_field": "video",
      "docs_source": "https://docs.higgsfield.ai/docs/models/seedance-2/reference-to-video.md",
      "docs_checked": "2026-09-21",
      "status": "active"
    },
    {
      "id": "seedance-2-5-text-to-video",
      "display_name": "Seedance 2.5 · Text to Video",
      "provider": "ByteDance",
      "family": "Seedance 2.5",
      "endpoint": "bytedance/seedance-2.5/text-to-video",
      "capability": "text_to_video",
      "output": "video",
      "parameters": [
        {"name": "prompt", "type": "string", "required": true},
        {"name": "resolution", "type": "string", "default": "720p", "choices": ["480p", "720p"]},